{
  "schema_version": "0.1.0",
  "region_id": "B",
  "label": "Kuzey Alaska aday penceresi içindeki teknik deneme noktası",
  "selection_status": "candidate",
  "candidate_bbox": [
    -156,
    68,
    -150,
    70
  ],
  "candidate_window_version": "search-window-0.1.0",
  "point": {
    "longitude": -153.0,
    "latitude": 69.0
  },
  "start_year": 2024,
  "end_year": 2024
}
